{
  "meta": {
    "kind": "nexora.release_evidence_cadence_contract",
    "version": "1.2.0",
    "status": "normative",
    "purpose": "Select the minimum dependency-correct release evidence cadence without weakening exact-byte, human-authority, fail-closed or final-candidate boundaries."
  },
  "governance": {
    "target_release": "1.1.1",
    "work_item_ids": [
      "release_train_candidate_cutover_and_patch_lane_contract",
      "installation_evidence_cadence_dependency_closure_contract",
      "release_validation_shared_source_index_and_test_suite_partition_contract"
    ],
    "one_publisher_owner_id": "existing_private_release_controller",
    "decision_authority": "evidence_cadence_only",
    "publication_authority": "never_inferred",
    "rule": "This contract chooses evidence cadence for the existing source-to-clean-to-public release train. It does not execute release stages, create a second publisher, issue a human seal, grant a license or authorize publication."
  },
  "validation": {
    "required_cadence_classes": [
      "always_fresh",
      "change_triggered",
      "baseline_plus_delta",
      "periodic",
      "final_candidate_aggregate"
    ],
    "required_aggregate_strategies": [
      "validate_content_bound_receipts_and_execute_invalidated_or_always_fresh",
      "fresh_execution"
    ],
    "required_subjects": [
      "full_release_proof",
      "clean_projection_bytes",
      "public_projection_bytes",
      "projected_public_tests",
      "independent_physical_install",
      "isolated_install",
      "ci_pull_request_fast",
      "ci_release_deep",
      "ci_periodic_compatibility",
      "human_doctrine_seal",
      "publication_authority",
      "react_corpus_replay",
      "claim_review",
      "license_review"
    ],
    "required_work_item_ids": [
      "release_train_candidate_cutover_and_patch_lane_contract",
      "installation_evidence_cadence_dependency_closure_contract"
    ],
    "required_independent_retest_triggers": [
      "installer_semantics_changed",
      "bootstrap_semantics_changed",
      "dependency_semantics_changed",
      "runtime_support_changed",
      "os_support_changed",
      "environment_specific_failure_observed"
    ],
    "required_owner_fields": [
      "id",
      "boundary",
      "authority",
      "sources",
      "may_publish"
    ],
    "required_subject_cadences": {
      "full_release_proof": [
        "final_candidate_aggregate"
      ],
      "clean_projection_bytes": [
        "always_fresh"
      ],
      "public_projection_bytes": [
        "always_fresh"
      ],
      "projected_public_tests": [
        "change_triggered",
        "final_candidate_aggregate"
      ],
      "independent_physical_install": [
        "baseline_plus_delta"
      ],
      "isolated_install": [
        "always_fresh"
      ],
      "ci_pull_request_fast": [
        "change_triggered"
      ],
      "ci_release_deep": [
        "final_candidate_aggregate"
      ],
      "ci_periodic_compatibility": [
        "periodic"
      ],
      "human_doctrine_seal": [
        "change_triggered"
      ],
      "publication_authority": [
        "always_fresh"
      ],
      "react_corpus_replay": [
        "change_triggered"
      ],
      "claim_review": [
        "change_triggered"
      ],
      "license_review": [
        "change_triggered"
      ]
    },
    "independent_install_evidence_id": "independent_physical_install",
    "version_only_trigger_id": "version_identity_changed",
    "allowed_owner_boundaries": [
      "source_repository",
      "private_release_controller"
    ],
    "unknown_cadence_behavior": "block",
    "unknown_trigger_behavior": "block",
    "unknown_owner_behavior": "block",
    "unknown_release_phase_behavior": "block"
  },
  "invariants": {
    "version_identity_change_alone_requires_independent_physical_retest": false,
    "independent_physical_retest_requires_protected_semantic_trigger": true,
    "missing_required_baseline_behavior": "block",
    "failed_stale_tampered_or_ambiguous_evidence_reuse": "forbidden",
    "final_candidate_aggregate_reuse": "content_bound_current_receipts_and_exact_frozen_candidate_identity_only",
    "machine_evidence_may_issue_human_authority": false,
    "cadence_decision_may_execute_publication": false,
    "release_version_is_not_an_evidence_identity": true,
    "change_invalidation_scope": "changed_evidence_and_semantic_descendants_only"
  },
  "input_contract": {
    "required_fields": [
      "release_phase",
      "triggers",
      "available_baselines"
    ],
    "release_phase_authority": {
      "source": "config/sage_self_development_validation_profiles.json",
      "json_pointer": "/input_contract/allowed_release_phases",
      "mapping_mode": "exact_shared_vocabulary"
    },
    "release_phases": [
      "development",
      "candidate",
      "frozen_candidate",
      "pre_seal",
      "publication"
    ],
    "trigger_catalog": [
      {
        "id": "governed_source_changed",
        "class": "source"
      },
      {
        "id": "configuration_changed",
        "class": "configuration"
      },
      {
        "id": "release_proof_dependency_changed",
        "class": "validation"
      },
      {
        "id": "clean_projection_input_changed",
        "class": "distribution"
      },
      {
        "id": "public_projection_input_changed",
        "class": "distribution"
      },
      {
        "id": "distribution_manifest_changed",
        "class": "distribution"
      },
      {
        "id": "public_test_contract_changed",
        "class": "validation"
      },
      {
        "id": "test_suite_changed",
        "class": "validation"
      },
      {
        "id": "explicit_focused_validation_selected",
        "class": "validation"
      },
      {
        "id": "installer_semantics_changed",
        "class": "installation"
      },
      {
        "id": "bootstrap_semantics_changed",
        "class": "installation"
      },
      {
        "id": "dependency_semantics_changed",
        "class": "installation"
      },
      {
        "id": "runtime_support_changed",
        "class": "installation"
      },
      {
        "id": "os_support_changed",
        "class": "installation"
      },
      {
        "id": "environment_specific_failure_observed",
        "class": "installation"
      },
      {
        "id": "ci_contract_changed",
        "class": "ci"
      },
      {
        "id": "periodic_compatibility_due",
        "class": "ci"
      },
      {
        "id": "protected_doctrine_changed",
        "class": "human_authority"
      },
      {
        "id": "agent_surface_semantics_changed",
        "class": "human_authority"
      },
      {
        "id": "publication_requested",
        "class": "human_authority"
      },
      {
        "id": "analysis_semantics_changed",
        "class": "external_evidence"
      },
      {
        "id": "corpus_contract_changed",
        "class": "external_evidence"
      },
      {
        "id": "external_evidence_gap_observed",
        "class": "external_evidence"
      },
      {
        "id": "explicit_corpus_evaluation_selected",
        "class": "external_evidence"
      },
      {
        "id": "claim_boundary_changed",
        "class": "claim"
      },
      {
        "id": "license_strategy_changed",
        "class": "license"
      },
      {
        "id": "version_identity_changed",
        "class": "metadata"
      }
    ]
  },
  "installation_trigger_derivation": {
    "analysis_delta_review_mode": "exact_git_bound_manual_review_with_conservative_ast_and_current_clean_venv",
    "evidence_governance_paths": [
      "config/release_evidence_cadence_contract.json",
      "config/source_layer_classification_policy.json",
      "config/source_layer_taxonomy.json",
      "tools/core/installation_semantic_delta.py",
      "tools/core/release_evidence_cadence.py",
      "tools/core/release_validation_dependencies.py",
      "tools/core/source_layer_classification_policy.py",
      "tools/core/source_layer_classifier.py",
      "tools/derive_release_evidence_cadence.py"
    ],
    "schema": "v1_content_bound_semantic_ownership",
    "authority": "central_source_cli_installation_and_runtime_owners",
    "source_role_contract": "config/source_role_obligation_contract.json",
    "root_entrypoint_role": "root_entrypoint",
    "proof_steps_contract": "config/release_proof_steps_contract.json",
    "proof_steps": [
      {
        "id": "installation_contract",
        "trigger": "installer_semantics_changed"
      },
      {
        "id": "installation_proof_smoke",
        "trigger": "installer_semantics_changed"
      }
    ],
    "exact_authority_paths": [
      {
        "path": "tools/core/installation_semantic_delta.py",
        "trigger": "release_proof_dependency_changed"
      },
      {
        "path": "tools/core/installation_authority.py",
        "trigger": "installer_semantics_changed"
      },
      {
        "path": "tools/core/installation_preflight.py",
        "trigger": "installer_semantics_changed"
      },
      {
        "path": "tools/core/installation_identity.py",
        "trigger": "installer_semantics_changed"
      },
      {
        "path": "tools/core/python_runtime_env.py",
        "trigger": "runtime_support_changed"
      },
      {
        "path": "config/release_evidence_cadence_contract.json",
        "trigger": "installer_semantics_changed"
      },
      {
        "path": "config/cli_command_contract.json",
        "trigger": "installer_semantics_changed"
      },
      {
        "path": "config/installation_preflight_contract.json",